video_file,asset_id,timestamp,action,hook,music,views,likes
shoemarketting1.mp4,69d1c0a3f295a02e53cc76a9,2026-04-05T01:53:49.715563+00:00,"At 00:00, a man stands on a city street at night, wearing a dark jacket and sporting a subtle smile, holding a striking iridescent purple sneaker in his right hand. From 00:00 to 00:01, he tilts the sneaker slightly toward the camera, emphasizing its design. The camera then zooms in from 00:01 to 00:02, focusing on the sneaker’s textured upper and reflective surface. Between 00:02 and 00:03, he rotates the shoe gently to reveal its side profile and sculpted sole. From 00:03 to 00:04, the camera continues to zoom in, highlighting the intricate details of the breathable mesh and responsive sole. At 00:04, he adjusts his grip, securing the sneaker more firmly. The camera pulls back slightly from 00:05 to 00:06, briefly showing his face and the urban backdrop before returning to a close-up. From 00:06 to 00:07, he maintains the pose, holding the sneaker upright and making deliberate eye contact with the camera, reinforcing a sense of confidence and connection with the viewer.","The video immediately captures attention with the vivid iridescent purple sneaker, which stands out dramatically against the dark, urban night setting. The man’s composed demeanor, subtle smile, and direct gaze create an aura of assurance and exclusivity. The dynamic camera movements—zooming in and rotating the shoe—build curiosity and emphasize the product’s futuristic design. The opening line, “Check out the future,” delivered with a confident tone, sets a visionary tone and positions the sneaker not just as footwear, but as a symbol of innovation and style, compelling viewers to continue watching to discover more.","The audio features a sleek, modern electronic track with a steady, mid-tempo beat that pulses in sync with the camera’s movements and the rhythmic emphasis on the sneaker’s design. The mood is futuristic and energetic, blending ambient textures with subtle synth layers that evoke a sense of innovation and urban sophistication. The music swells slightly during the zoom-in and rotation sequences, enhancing the visual drama and reinforcing the theme of “stepping into tomorrow.” The overall sound design complements the sleek visuals and the confident delivery of the narration, creating a cohesive sensory experience that aligns perfectly with the product’s high-tech, forward-thinking identity.",0,0
celssiusmarketing2.mp4,69d1c9179ffca0861030bde3,2026-04-05T02:29:54.310635+00:00,"At 00:00, the video opens with a futuristic, blue-skinned woman standing confidently in the center of a vibrant, neon-lit city street at night. She holds a Celsius Sparkling energy drink can in her right hand, arm extended forward in a dynamic pose. The camera begins a smooth zoom-in toward the can and her hand, starting at 00:00 and continuing through 00:02. By 00:02, the focus tightens on the product label, with the background gradually blurring to emphasize the drink. From 00:02 to 00:06, the camera maintains the close-up on the can, subtly adjusting focus to highlight the branding and texture of the can. At 00:06, the camera smoothly zooms out, revealing the woman now framed within a large, glowing neon circle that pulses faintly around her. She remains motionless, holding the can aloft, exuding a sense of energy and presence throughout the 00:08 duration.","The hook is immediate and visually striking: the juxtaposition of a surreal, blue-skinned woman against a hyper-realistic, bustling urban night scene creates a strong sense of intrigue. The futuristic aesthetic, combined with the glowing neon environment and the dramatic camera movement—starting with a close-up on the product and expanding to reveal the larger, stylized frame—immediately captures attention. The woman’s confident stance and the glowing neon circle around her create a cinematic, almost otherworldly atmosphere that compels viewers to keep watching, eager to understand the narrative or message behind the scene.","The audio track features an energetic, electronic beat with a driving tempo and a modern synthwave influence, evoking a high-energy, futuristic mood. The music builds in intensity from the beginning, aligning perfectly with the camera’s zoom-in and the visual escalation of the scene. At 00:00, the beat drops with a sharp, pulsing rhythm that syncs with the visual focus on the can. The track maintains a consistent, vibrant tempo throughout, enhancing the sense of motion and excitement. The synth-heavy instrumentation complements the neon-lit cityscape and the woman’s futuristic appearance, reinforcing the theme of vitality and modernity. The audio line “Elevate your energy. Live fit with Celsius. Sparkling orange. Unleash the night.” is delivered with a confident, rhythmic cadence that matches the music’s momentum, creating a seamless fusion of sound and image that amplifies the brand’s message of energy and empowerment.",0,0
shoemarketting1.mp4,69d1d653cb42041ab6d1b421,2026-04-05T03:26:22.987357+00:00,"At 00:00, a man stands in the middle of a city street at night, smiling directly at the camera while holding a vibrant iridescent purple sneaker in his right hand. From 00:00 to 00:01, he gently brings the sneaker closer to the camera, emphasizing its design. Between 00:01 and 00:02, the camera zooms in on the sneaker, focusing on its textured, breathable mesh upper and sculpted sole. From 00:02 to 00:03, the man maintains his pose, keeping the sneaker elevated and continuing to make eye contact. The camera lingers on the sneaker’s details from 00:03 to 00:04, highlighting its reflective, shifting color. At 00:04 to 00:05, he subtly adjusts his grip, ensuring the sneaker remains centered in frame. From 00:05 to 00:06, the camera pulls back slightly, revealing more of the urban environment and the man’s full silhouette. From 00:06 to 00:07, he holds the sneaker steady with a calm, confident expression. At 00:07 to 00:08, the camera shifts focus to his face, capturing his engaging smile and direct gaze, reinforcing a personal connection with the viewer.","The video’s hook lies in the striking visual contrast of the iridescent purple sneaker against the dark, neon-lit cityscape. The bold color and futuristic design immediately command attention. Combined with the man’s confident smile and direct eye contact, the opening moment creates a sense of intrigue and exclusivity—inviting viewers to wonder about the sneaker’s innovation and purpose. The dynamic camera movement, starting close on the product and pulling back slightly, enhances the sense of discovery, making the viewer feel like they’re being introduced to something revolutionary.","The audio features a sleek, electronic track with a steady, mid-tempo beat (approximately 100–110 BPM), blending ambient synths with subtle rhythmic pulses. The mood is futuristic, energetic, and aspirational—perfectly aligning with the sneaker’s high-tech aesthetic. The music swells slightly during the camera zoom and pull-back, synchronizing with the visual pacing to amplify the sense of anticipation. The sound design complements the visuals by enhancing the ""future-forward"" theme, reinforcing the message that this is not just a shoe, but a statement of innovation and style. The dialogue, spoken at 00:00–00:08, reinforces this: “Check out the future. Iridescent purple, breathable mesh, and a responsive sculpted sole. It's not just a sneaker, it's a statement. Step into tomorrow,” perfectly timed with the visual rhythm, creating a cohesive and immersive experience.",0,0
celssiusmarketing2.mp4,69d1d670b40e0df9e2ca9722,2026-04-05T03:26:50.611876+00:00,"- [00:00–00:02] The video opens with a futuristic, blue-skinned woman standing confidently in the center of a vibrant, neon-lit city street at night. She holds a Celsius Sparkling energy drink can in her right hand, arm fully extended forward, as if presenting the product. The camera begins a smooth zoom-in toward her and the can, creating a sense of focus and anticipation.  
- [00:02–00:06] The zoom continues, tightening on the can’s label and the woman’s hand, blurring the background to emphasize the product. The lighting on the can glints under the city’s neon glow, highlighting its design and branding.  
- [00:06–00:08] The camera slowly zooms out, revealing that the woman is standing within a large, glowing circular halo of neon light, which pulses faintly. She maintains her pose throughout, exuding a sense of energy and readiness, as if poised to unleash something dynamic.","The hook lies in the striking visual contrast between the futuristic, otherworldly appearance of the woman and the hyper-realistic, bustling urban environment. Her blue skin and stylized features immediately stand out, creating a sense of intrigue and novelty. The opening shot’s tight focus on the can, combined with the dynamic camera movement and the glowing neon circle, creates a cinematic, high-energy atmosphere. The combination of surreal aesthetics and urban realism draws the viewer in within the first two seconds, compelling them to watch as the camera reveals more of the scene and the product’s prominence.","The audio track features an energetic, electronic beat with a driving tempo and a pulsing rhythm that syncs with the visual pacing—particularly the camera zooms and the subtle glow of the neon circle. The mood is vibrant, modern, and invigorating, blending elements of synthwave and dance-pop. The music builds subtly throughout the 8 seconds, matching the escalating visual intensity. It complements the action by amplifying the sense of momentum and excitement, reinforcing the brand’s message of energy and vitality. The spoken line “Elevate your energy. Live fit with Celsius. Sparkling orange. Unleash the night.” is delivered with a confident, rhythmic cadence that aligns perfectly with the beat, enhancing the overall impact and memorability of the ad.",0,0
